{
  "ir_type": "scene",
  "version": "0.1",
  "scene_id": "scene_urban_alley_01",
  "name": "Sotonbori Backstreet Alley",
  "description": "Narrow nightlife district alley running between a club facade and a service yard.",
  "scene_type": "exterior_location",
  "preset": "urban_alley",
  "standalone": true,
  "parent_world_id": "world_jisso_city",
  "parent_scene_slot_id": "sotonbori_club_back_alley",
  "bounds": { "width_m": 80.0, "depth_m": 45.0, "height_m": 25.0 },
  "theme": "neon_urban_night",
  "tags": ["alley", "nightlife", "stealth"],

  "zones": [
    {
      "id": "zone_main_alley",
      "name": "Main Alley",
      "zone_type": "path",
      "polygon": { "points": [
        { "x": 5.0,  "y": 18.0 },
        { "x": 75.0, "y": 18.0 },
        { "x": 75.0, "y": 27.0 },
        { "x": 5.0,  "y": 27.0 }
      ]},
      "tags": ["main_path"]
    },
    {
      "id": "zone_service_yard",
      "name": "Service Yard",
      "zone_type": "service_area",
      "polygon": { "points": [
        { "x": 50.0, "y": 3.0 },
        { "x": 75.0, "y": 3.0 },
        { "x": 75.0, "y": 17.0 },
        { "x": 50.0, "y": 17.0 }
      ]},
      "tags": ["dumpsters", "vendor"]
    },
    {
      "id": "zone_side_passage",
      "name": "Side Passage",
      "zone_type": "stealth_route",
      "polygon": { "points": [
        { "x": 28.0, "y": 28.0 },
        { "x": 34.0, "y": 28.0 },
        { "x": 34.0, "y": 42.0 },
        { "x": 28.0, "y": 42.0 }
      ]},
      "tags": ["narrow"]
    },
    {
      "id": "zone_combat_pocket",
      "name": "Combat Pocket",
      "zone_type": "combat_space",
      "polygon": { "points": [
        { "x": 5.0,  "y": 28.0 },
        { "x": 24.0, "y": 28.0 },
        { "x": 24.0, "y": 42.0 },
        { "x": 5.0,  "y": 42.0 }
      ]}
    }
  ],

  "entrances": [
    { "id": "ent_street_main", "name": "Street Main Entrance",
      "position": { "x": 2.0, "y": 22.5 }, "entrance_type": "main" },
    { "id": "ent_service_back", "name": "Service Backdoor",
      "position": { "x": 78.0, "y": 10.0 }, "entrance_type": "backdoor" },
    { "id": "ent_side_passage", "name": "Side Passage Entry",
      "position": { "x": 31.0, "y": 44.0 }, "entrance_type": "side" },
    { "id": "ent_roof_stairs", "name": "Roof Stairs Access",
      "position": { "x": 60.0, "y": 28.0 }, "entrance_type": "roof",
      "connects_to": "roof_above" }
  ],

  "paths": [
    {
      "id": "path_main_route", "name": "Main Route",
      "path_type": "main_route",
      "points": [
        { "x": 2.0,  "y": 22.5 },
        { "x": 40.0, "y": 22.5 },
        { "x": 78.0, "y": 22.5 }
      ],
      "width_m": 4.0
    },
    {
      "id": "path_escape_north", "name": "Escape via Side Passage",
      "path_type": "escape_route",
      "points": [
        { "x": 40.0, "y": 22.5 },
        { "x": 31.0, "y": 30.0 },
        { "x": 31.0, "y": 44.0 }
      ],
      "width_m": 2.0
    },
    {
      "id": "path_escape_service", "name": "Escape via Service Yard",
      "path_type": "escape_route",
      "points": [
        { "x": 40.0, "y": 22.5 },
        { "x": 60.0, "y": 18.0 },
        { "x": 78.0, "y": 10.0 }
      ],
      "width_m": 3.0
    }
  ],

  "objects": [
    { "id": "obj_wall_north", "name": "North Building Wall", "object_type": "wall",
      "transform": { "position": { "x": 40.0, "y": 43.5, "z": 0.0 } },
      "size": { "width_m": 70.0, "depth_m": 1.0, "height_m": 18.0 } },
    { "id": "obj_wall_south", "name": "South Building Wall", "object_type": "wall",
      "transform": { "position": { "x": 25.0, "y": 16.5, "z": 0.0 } },
      "size": { "width_m": 38.0, "depth_m": 1.0, "height_m": 18.0 } },
    { "id": "obj_dumpster_a", "name": "Dumpster A", "object_type": "cover",
      "transform": { "position": { "x": 60.0, "y": 8.0, "z": 0.0 } },
      "size": { "width_m": 2.0, "depth_m": 1.4, "height_m": 1.3 } },
    { "id": "obj_dumpster_b", "name": "Dumpster B", "object_type": "cover",
      "transform": { "position": { "x": 66.0, "y": 8.0, "z": 0.0 } },
      "size": { "width_m": 2.0, "depth_m": 1.4, "height_m": 1.3 } },
    { "id": "obj_stack_crates", "name": "Stack of Crates", "object_type": "cover",
      "transform": { "position": { "x": 20.0, "y": 35.0, "z": 0.0 } },
      "size": { "width_m": 1.5, "depth_m": 1.5, "height_m": 1.4 } },
    { "id": "obj_vending", "name": "Vending Machine", "object_type": "prop",
      "transform": { "position": { "x": 8.0, "y": 19.5, "z": 0.0 } },
      "size": { "width_m": 1.2, "depth_m": 0.6, "height_m": 1.9 } },
    { "id": "obj_roof_stairs", "name": "External Stairs", "object_type": "stairs",
      "transform": { "position": { "x": 60.0, "y": 30.0, "z": 0.0 } },
      "size": { "width_m": 1.5, "depth_m": 5.0, "height_m": 6.0 } }
  ],

  "gameplay_markers": [
    { "id": "mk_cover_1", "marker_type": "cover", "position": { "x": 60.0, "y": 9.0 } },
    { "id": "mk_cover_2", "marker_type": "cover", "position": { "x": 66.0, "y": 9.0 } },
    { "id": "mk_cover_3", "marker_type": "cover", "position": { "x": 20.0, "y": 34.0 } },
    { "id": "mk_cover_4", "marker_type": "cover", "position": { "x": 35.0, "y": 19.5 } },
    { "id": "mk_cover_5", "marker_type": "cover", "position": { "x": 14.0, "y": 30.0 } },
    { "id": "mk_ambush_1", "marker_type": "ambush", "position": { "x": 31.0, "y": 37.0 } },
    { "id": "mk_player_spawn", "marker_type": "player_spawn", "position": { "x": 5.0, "y": 22.5 } },
    { "id": "mk_enemy_1", "marker_type": "enemy_spawn", "position": { "x": 70.0, "y": 22.5 } },
    { "id": "mk_climb_drainpipe", "marker_type": "climb", "position": { "x": 55.0, "y": 28.0 } },
    { "id": "mk_extract", "marker_type": "extraction", "position": { "x": 31.0, "y": 44.0 } }
  ],

  "constraints": [
    { "id": "c_min_entr", "constraint_type": "must_have_min_entrances", "params": { "min": 3 } },
    { "id": "c_min_escape", "constraint_type": "must_have_min_escape_routes", "params": { "min": 2 } },
    { "id": "c_min_cover", "constraint_type": "must_have_min_cover_markers", "params": { "min": 5 } },
    { "id": "c_in_bounds", "constraint_type": "must_be_inside_bounds", "severity": "warning" }
  ]
}
