{
  "ir_type": "scene",
  "version": "0.1",
  "scene_id": "scene_warehouse_interior_01",
  "name": "Minato Bay Warehouse Interior",
  "description": "Mid-size port warehouse interior with storage aisles and an office corner.",
  "scene_type": "interior",
  "preset": "warehouse_interior",
  "standalone": true,
  "parent_world_id": "world_jisso_city",
  "parent_scene_slot_id": "minato_warehouse_interior",
  "bounds": { "width_m": 70.0, "depth_m": 50.0, "height_m": 12.0 },
  "theme": "industrial_concrete",
  "tags": ["warehouse", "interior", "industrial"],

  "zones": [
    {
      "id": "zone_loading", "name": "Loading Zone", "zone_type": "service_area",
      "polygon": { "points": [
        { "x": 1.0, "y": 1.0 }, { "x": 25.0, "y": 1.0 },
        { "x": 25.0, "y": 18.0 }, { "x": 1.0, "y": 18.0 }
      ]},
      "height_m": 12.0
    },
    {
      "id": "zone_storage_a", "name": "Storage Aisle A", "zone_type": "storage",
      "polygon": { "points": [
        { "x": 26.0, "y": 1.0 }, { "x": 50.0, "y": 1.0 },
        { "x": 50.0, "y": 18.0 }, { "x": 26.0, "y": 18.0 }
      ]},
      "height_m": 12.0
    },
    {
      "id": "zone_storage_b", "name": "Storage Aisle B", "zone_type": "storage",
      "polygon": { "points": [
        { "x": 1.0, "y": 19.0 }, { "x": 50.0, "y": 19.0 },
        { "x": 50.0, "y": 35.0 }, { "x": 1.0, "y": 35.0 }
      ]},
      "height_m": 12.0
    },
    {
      "id": "zone_corridor", "name": "Service Corridor", "zone_type": "service_area",
      "polygon": { "points": [
        { "x": 1.0, "y": 36.0 }, { "x": 69.0, "y": 36.0 },
        { "x": 69.0, "y": 41.0 }, { "x": 1.0, "y": 41.0 }
      ]},
      "height_m": 4.0
    },
    {
      "id": "zone_office", "name": "Office Corner", "zone_type": "room",
      "polygon": { "points": [
        { "x": 51.0, "y": 1.0 }, { "x": 69.0, "y": 1.0 },
        { "x": 69.0, "y": 18.0 }, { "x": 51.0, "y": 18.0 }
      ]},
      "height_m": 3.0
    },
    {
      "id": "zone_objective", "name": "Objective Vault", "zone_type": "private_area",
      "polygon": { "points": [
        { "x": 51.0, "y": 19.0 }, { "x": 69.0, "y": 19.0 },
        { "x": 69.0, "y": 35.0 }, { "x": 51.0, "y": 35.0 }
      ]},
      "height_m": 4.0
    }
  ],

  "entrances": [
    { "id": "ent_main", "name": "Main Roller Door",
      "position": { "x": 12.0, "y": 0.5 }, "entrance_type": "main" },
    { "id": "ent_service", "name": "Service Door",
      "position": { "x": 69.5, "y": 8.0 }, "entrance_type": "service" },
    { "id": "ent_emergency", "name": "Emergency Exit",
      "position": { "x": 35.0, "y": 49.5 }, "entrance_type": "emergency" },
    { "id": "ent_roof", "name": "Roof Hatch",
      "position": { "x": 60.0, "y": 38.0 }, "entrance_type": "roof",
      "connects_to": "warehouse_roof" }
  ],

  "paths": [
    {
      "id": "path_main", "name": "Main Route",
      "path_type": "main_route",
      "points": [
        { "x": 12.0, "y": 1.5 },
        { "x": 12.0, "y": 38.0 },
        { "x": 60.0, "y": 38.0 },
        { "x": 60.0, "y": 22.0 }
      ],
      "width_m": 3.0
    },
    {
      "id": "path_stealth", "name": "Stealth Route Behind Aisles",
      "path_type": "stealth_route",
      "points": [
        { "x": 2.0,  "y": 19.5 },
        { "x": 2.0,  "y": 38.0 },
        { "x": 50.0, "y": 38.0 }
      ],
      "width_m": 1.5
    },
    {
      "id": "path_escape", "name": "Escape via Emergency Exit",
      "path_type": "escape_route",
      "points": [
        { "x": 60.0, "y": 22.0 },
        { "x": 40.0, "y": 38.0 },
        { "x": 35.0, "y": 49.0 }
      ],
      "width_m": 2.5
    }
  ],

  "objects": [
    { "id": "obj_rack_a1", "name": "Rack A1", "object_type": "container",
      "transform": { "position": { "x": 30.0, "y": 5.0, "z": 0.0 } },
      "size": { "width_m": 6.0, "depth_m": 1.5, "height_m": 4.0 } },
    { "id": "obj_rack_a2", "name": "Rack A2", "object_type": "container",
      "transform": { "position": { "x": 30.0, "y": 10.0, "z": 0.0 } },
      "size": { "width_m": 6.0, "depth_m": 1.5, "height_m": 4.0 } },
    { "id": "obj_rack_a3", "name": "Rack A3", "object_type": "container",
      "transform": { "position": { "x": 30.0, "y": 15.0, "z": 0.0 } },
      "size": { "width_m": 6.0, "depth_m": 1.5, "height_m": 4.0 } },
    { "id": "obj_rack_b1", "name": "Rack B1", "object_type": "container",
      "transform": { "position": { "x": 10.0, "y": 22.0, "z": 0.0 } },
      "size": { "width_m": 8.0, "depth_m": 1.5, "height_m": 4.0 } },
    { "id": "obj_rack_b2", "name": "Rack B2", "object_type": "container",
      "transform": { "position": { "x": 10.0, "y": 28.0, "z": 0.0 } },
      "size": { "width_m": 8.0, "depth_m": 1.5, "height_m": 4.0 } },
    { "id": "obj_office_desk", "name": "Office Desk", "object_type": "furniture",
      "transform": { "position": { "x": 60.0, "y": 6.0, "z": 0.0 } },
      "size": { "width_m": 1.6, "depth_m": 0.8, "height_m": 0.8 } },
    { "id": "obj_vault_door", "name": "Vault Door", "object_type": "door",
      "transform": { "position": { "x": 52.0, "y": 27.0, "z": 0.0 } },
      "size": { "width_m": 1.2, "depth_m": 0.3, "height_m": 2.4 } },
    { "id": "obj_pallet_stack", "name": "Pallet Stack", "object_type": "cover",
      "transform": { "position": { "x": 18.0, "y": 8.0, "z": 0.0 } },
      "size": { "width_m": 1.4, "depth_m": 1.2, "height_m": 1.2 } }
  ],

  "gameplay_markers": [
    { "id": "mk_cover_loading_1", "marker_type": "cover", "position": { "x": 18.0, "y": 7.0 } },
    { "id": "mk_cover_aisle_a1", "marker_type": "cover", "position": { "x": 34.0, "y": 5.0 } },
    { "id": "mk_cover_aisle_a2", "marker_type": "cover", "position": { "x": 26.5, "y": 10.0 } },
    { "id": "mk_cover_aisle_b1", "marker_type": "cover", "position": { "x": 6.0,  "y": 22.0 } },
    { "id": "mk_cover_aisle_b2", "marker_type": "cover", "position": { "x": 14.0, "y": 28.0 } },
    { "id": "mk_cover_corridor", "marker_type": "cover", "position": { "x": 45.0, "y": 37.5 } },
    { "id": "mk_cover_office",   "marker_type": "cover", "position": { "x": 58.0, "y": 5.0 } },
    { "id": "mk_objective", "marker_type": "objective", "position": { "x": 60.0, "y": 27.0 } },
    { "id": "mk_player_spawn", "marker_type": "player_spawn", "position": { "x": 12.0, "y": 2.0 } },
    { "id": "mk_enemy_a", "marker_type": "enemy_spawn", "position": { "x": 38.0, "y": 30.0 } },
    { "id": "mk_enemy_b", "marker_type": "enemy_spawn", "position": { "x": 58.0, "y": 32.0 } }
  ],

  "constraints": [
    { "id": "c_min_entr", "constraint_type": "must_have_min_entrances", "params": { "min": 3 } },
    { "id": "c_min_escape", "constraint_type": "must_have_min_escape_routes", "params": { "min": 1 } },
    { "id": "c_min_cover", "constraint_type": "must_have_min_cover_markers", "params": { "min": 6 } },
    { "id": "c_inside", "constraint_type": "must_be_inside_bounds", "severity": "warning" }
  ]
}
